Title,Start date,End date,Date to be decided,Location,Organisers,Meetings summary,Relevance to the post-2020 process,Link to further information,Groupings,2nd grouping (where appropriate),Relation to the CBD's post-2020 process
Mapping our conservation future: scoping workshop,06/06/2017,06/06/2017,,"Cambridge, UK",UNEP-WCMC,"The Mapping our conservation future: scoping workshop focused on scaling up ambition for area-based conservation. It brought together an international collection of biodiversity-related institutions to discuss three key questions: 1) How can we provide meaningful data on biodiversity at a scale needed for decision making? 2) What is needed for the biodiversity community to speak with one voice on biodiversity prioritisation - i.e. where is important to focus conservation efforts? 3)  How can we assess where important biodiversity is, and is not, being effectively managed?",This workshop explored options to scale-up area based conservation beyond 2020.,A workshop report is available on request: post-2020@unep-wcmc.org,Area-based conservation,,Other relevance
1st meeting of the IUCN WCPA Beyond the Aichi Targets Task Force ,03/07/2017,07/07/2017,,"Vilm, Germany",IUCN,The IUCN's World Commission on Protected Areas (WCPA) meeting focused on developing an engagement and technical strategy to scale up area-based conservation.,The Task Force will assist Convention on Biological Diversity (CBD) Parties to  build momentum for the Promise of Sydney to scale up conservation.,https://www.iucn.org/protected-areas/wcpa/what-we-do/beyond-aichi-targets,Area-based conservation,,Explicitly contributing to the process
IMPAC 4,04/09/2017,08/09/2017,,"La Serena - Coquimbo, Chile","IUCN, Government of Chile",The Fourth International Marine Protected Areas Congress (IMPAC 4) brought together stakeholders to define recommendations on policy processes and to assist in establishing a global network of effectively managed Marine Protected Areas. Particular focus was placed on ocean-human relationships and the impacts of Marine Protected Areas.,The conference was an opportunity to assess progress towards delivering on the Strategic Plan for Biodiversity 2011-2020 and its Aichi Biodiversity Targets on marine conservation.,http://www.impac4.org/en/homepage/ http://enb.iisd.org/download/pdf/sd/enbplus186num9e.pdf,Marine-focus,,Other relevance
Half-Earth Day,23/10/2017,23/10/2017,,"National Geographic HQ, Washington, DC","E. O. Wilson Biodiversity Foundation, National Geographic",The Fourth International Marine Protected Areas Congress (IMPAC 4) brought together stakeholders to define recommendations on policy processes and to assist in establishing a global network of effectively managed Marine Protected Areas. Particular focus was placed on ocean-human relationships and the impacts of Marine Protected Areas.,Half-Earth is one initiative looking at how to manage half of the planet for nature.,http://www.half-earthproject.org/,Area-based conservation,Communications,Other relevance
GEO-XIV Plenary,25/10/2017,26/10/2017,,"Washington, DC",Group on Earth Observations,This meeting explored the use and applications of Earth observations with stakeholders from the global network of the Group on Earth Observations (GEO).,"The GEO Plenary provided an opportunity to exchange knowledge, identify gaps and reduce duplication in the areas of sustainable development and environmental management.",http://www.earthobservations.org/geo14.php,,,Other relevance
1st Bogis-Bossey Dialogue for Transformational Change on Biodiversity,12/11/2017,14/11/2017,,"Bogis-Bossey, Switzerland","CBD Secretariat, Swiss government"," The Secretariat of the Convention on Biological Diversity (CBD) convened the first of a series of dialogues, with the support of the Government of Switzerland. The goal was to identify a transformative agenda for action in sectors and domains that have an impact on or benefit from biodiversity.  ","The meeting provided the opportunity to identify how the CBD and wider biodiversity community can leverage transformational change, both in the lead up to 2020 and through the post-2020 global biodiversity framework. ",https://www.cbd.int/doc/c/9275/a98b/ed07b3d583d07a51860c9111/sbstta-21-inf-19-en.pdf,,,Explicitly contributing to the process
UNEA 3,04/12/2017,06/12/2017,,"Nairobi, Kenya",UN Environment,The meeting of the UN Environment Assembly (UNEA 3) brought together Member States and a variety of stakeholders to address the issue of pollution. ,This meeting provided an opportunity to consult on how linkages between pollution and biodiversity can be more effectively integrated into the future post-2020 biodiversity framework.,http://web.unep.org/environmentassembly/assembly,Intergovernmental processes,,Other relevance
WWF Towards a new CBD Strategy 2021-2030 First International Workshop,10/12/2017,11/12/2017,,"Montreal, Canada",WWF,"This is the first in a series of meetings to discuss the vision, mission and five strategic goals of the current Strategic Plan 2011-2020. The following questions were addressed: 1. Should the vision, mission, and five strategic goals be maintained, adjusted, or amended? 2. Do we need additional goals until 2030 to better link with the Sustainable Development Goals (SDGs)?","Intermediate results were presented at the margins of SBSTTA-21, SBSTTA-22 and SBI-2. The discussion paper will be presented at the 14th Conference of the Parties 2018 in Egypt.",,,,Explicitly contributing to the process
CBD SBSTTA-21,11/12/2017,14/12/2017,,"Montreal, Canada",CBD Secretariat,"The Convention on Biological Diversity's (CBD) twenty-first Meeting of the Subsidiary Body on Scientific, Technical and Technological Advice (SBSTTA-21) focussed on information concerning biodiversity-related scenarios and related scientific and technical information on trends and projections towards 2050 and possible pathways to achieve the 2050 Vision.  ",This meeting presented the opportunity to provide policy relevant syntheses of future pathways for biodiversity and ecosystem services.,https://www.cbd.int/doc/c/4a22/3eba/a499b54091a1c1e22bb7b54e/sbstta-21-02-en.pdf,Intergovernmental processes,,Part of the formal process
International Water Summit 2018,15/01/2018,18/01/2018,,"Abu Dhabi, UAE",Masdar,The Summit brought together stakeholders to develop new strategies on sustainable water use and technologies. ,This Summit provided an opportunity to engage with the water sector on how linkages between water and biodiversity can be more effectively integrated into the future post-2020 biodiversity framework,https://www.internationalwatersummit.com/,,,Other relevance
Technical Expert Workshop on Other Effective Area-Based Conservation Measures for Achieving Aichi Biodiversity Target 11,06/02/2018,09/02/2018,,"Montreal, Canada",CBD Secretariat,"This workshop aimed to provide scientific and technical advice on definition, management approaches, and identification of other effective area-based conservation measures in the terrestrial realm, as well as their role in achieving Aichi Biodiversity Target 11.",Future targets are likely to consider other effective area-based conservation measures in terrestrial and marine realms. ,https://www.cbd.int/meetings/PAEM-2018-01,Area-based conservation,,Other relevance
Expert Workshop on Marine Protected Areas and Other Effective Area-based Conservation Measures for Achieving Aichi Biodiversity Target 11 in Marine and Coastal Areas,06/02/2018,09/02/2018,,"Montreal, Canada",CBD Secretariat,"This workshop aimed to provide scientific and technical advice on definition, management approaches, and identification of other effective area-based conservation measures in the marine realm, as well as their role in achieving Aichi Biodiversity Target 11.",Future targets are likely to consider other effective area-based conservation measures in terrestrial and marine realms. ,https://www.cbd.int/meetings/MCB-EM-2018-01,Area-based conservation,,Other relevance
9th Session of the World Urban Forum,07/02/2018,13/02/2018,,"Kuala Lumpur, Malaysia",United Nations Human Settlements Programme,"The Ninth Session of the World Urban Forum (WUF9) focuses on the New Urban Agenda, as agreed at Habitat III, as an approach to achieve Agenda 2030 and the Sustainable Development Goals. ",This represents an opportunity to engage in discussions on the linkages between cities and biodiversity,http://wuf9.org/,,,Other relevance
Deadline for comments on the draft document: 'proposals for a comprehensive and participatory process for the preparation of the post-2020 biodiversity framework',16/02/2018,16/02/2018,,N/A,CBD Secretariat,"A draft document on 'proposals for a comprehensive and participatory process for the preparation of the post-2020 biodiversity framework' has been made available for peer review. The deadline for comments, as well as any other relevant input, is 16 February 2018.","The present note has been prepared by the Executive Secretary to provide the Subsidiary Body on Implementation with proposals concerning the process for the development of a follow up to the Strategic Plan for Biodiversity 2011-2020. It draws on the submissions received in response to a notification issued inviting Parties, other Governments, relevant organisations and indigenous peoples and local communities to provide comments and inputs on the process for developing the post 2020 global biodiversity framework. It also draws on experiences in developing the Strategic Plan for Biodiversity 2011-2020 in the lead-up to the tenth meeting of the Conference of the Parties. ",https://www.cbd.int/post2020/,,,Part of the formal process
"Symposium on Safeguarding space for nature, securing our future: developing a post-2020 strategy",27/02/2018,28/02/2018,,"London, UK","ZSL, NGS, UNEP-WCMC, IUCN, BirdLife International","The meeting will focus on:
(1) reviewing the science informing future area-based conservation targets 
(2) evaluating the implications of various policy options 
(3) provide balanced, evidence-based recommendations to Parties to the CBD and other policy processes and 
(4) raise awareness of the need for a more ambitious, holistic and effective strategy on space for nature, incorporating protected areas and other effective area-based conservation measures. 
","The meeting will be used to prepare an information document to inform discussion on the post-2020 global biodiversity framework at COP14, and if possible at the preparatory meetings in 2018.  ",https://www.zsl.org/science/whats-on/safeguarding-space-for-nature-and-securing-our-future-developing-a-post-2020,Area-based conservation,,Explicitly contributing to the process
UN World Wildlife Day 2018,03/03/2018,03/03/2018,,Worldwide,CITES Secretariat,"UN World Wildlife Day celebrates and raises awareness of the world's wild animals and plants. The theme for World Wildlife Day 2018 is ""Big Cats"". ",World Wildlife Day aims to raise awareness of biodiversity which relates to Aichi Biodiversity Target 12 of the Strategic Plan for Biodiversity 2011-2020.,http://www.wildlifeday.org/,Communications,,Other relevance
World Ocean Summit 2018,07/03/2018,09/03/2018,,"Cancún-Playa del Carmen, Mexico",The Economist Group,"The World Ocean Summit brings together business, government and civil society to consider how the ocean is used. ","The Summit presents an opportunity for stakeholders, in particular the private sector, to scale up ambitions for the sustainable use of the oceans. ",https://events.economist.com/events-conferences/americas/world-ocean-summit/,Marine-focus,,Other relevance
IPBES-6 Plenary,17/03/2018,24/03/2018,,"Medellin, Colombia",IPBES,"The sixth meeting of the Intergovernmental Science-Policy Platform on Biodiversity and Ecosystem Services (IPBES-6) will discuss implementation of the work programme 2014-2018, deliverables and assessments.",This Plenary provides an opportunity to discuss how regional and sub-regional assessments can be used in planning and delivering of the post-2020 biodiversity agenda.,https://www.ipbes.net/event/ipbes-6-plenary,Intergovernmental processes,,Other relevance
8th World Water Forum,18/03/2018,23/03/2018,,"Brasilia, Brazil",World Water Council,"The World Water Forum brings together individuals and organisations interested in the theme of water, the nine forum themes and the 17 Sustainable Development Goals.",This meeting provides the opportunity to enhance linkages between water and biodiversity,http://www.worldwaterforum8.org/,,,Other relevance
2nd Bogis-Bossey Dialogue for Transformational Change on Biodiversity,01/04/2018,30/04/2018,x,"Bogis-Bossey, Switzerland",CBD Secretariat ,"This is the second in a series of dialogues, convened by the Secretariat of the CBD with the support of the Government of Switzerland. This meeting brings Parties together to discuss the outcomes of the first dialogue and identify a transformative agenda for action.","The meeting provides an opportunity to contribute to discussions on an ambitious, innovative, yet pragmatic post-2020 global biodiversity framework.",,,,Explicitly contributing to the process
CCI Expert Workshop: Framing the Future for Biodiversity,10/04/2018,12/04/2018,,"Cambridge, UK","UNEP-WCMC, BirdLife International, RSPB, Cambridge University, IUCN, ZSL, Defra","The Cambridge Conservation Initiative (CCI) is convening a workshop that will bring together key players involved in different aspects of developing and implementing plans and strategies for the conservation and sustainable use of biodiversity, and reviewing their implementation.",This meeting provides the opportunity to examine the evidence base required to underpin the development of the new biodiversity framework .,,,,Explicitly contributing to the process
CCI Workshop: Communicating the Future for Biodiversity,13/04/2018,13/04/2018,,"Cambridge, UK","UNEP-WCMC, BirdLife International, RSPB, Cambridge University, IUCN, ZSL, Defra, CBD","Following the workshop on Framing the Future for Biodiversity, this meeting will bring together communication experts to exchange and coordinate information on existing ongoing communication activities and will explore the most effective mechanisms to ensure coherent messages and activities in the lead up to 2020.",This meeting provides the opportunity to develop coherent messages and activities in the lead up to 2020.  ,,Communications,,Other relevance
World Conference on Marine Biodiversity 2018,13/05/2018,16/05/2018,,"Montreal, Canada",WCMB Congress Secretariat,"The 4th World Conference on Marine Biodiversity will bring together scientists, practitioners, and policy makers to discuss and advance our understanding of the importance and current state of biodiversity in the marine environment.",This conference provides opportunities to discuss strategies for conservation of marine biodiversity in the context of the current Strategic Plan for Biodiversity 2011-2020,http://www.wcmb2018.org/,Marine-focus,,Other relevance
International Day for Biological Diversity 2018,22/05/2018,22/05/2018,,Worldwide,United Nations,This is a day to increase an understanding and awareness of biodiversity issues.  The theme for this year is to celebrate 25 years of action for biodiversity.,,https://www.cbd.int/idb/,Communications,,Other relevance
World Environment Day 2018,05/06/2018,05/06/2018,,Worldwide,United Nations,World Environment Day is the United Nations’ day for encouraging worldwide awareness and action for the protection of our environment. It is celebrated in over 100 countries. The theme this year is plastic pollution.,The day provides an opportunity for driving the momentum and public pressure for the upcoming CBD 14th meeting of the Conference of the Parties (COP14).,http://worldenvironmentday.global/,,,Other relevance
5th European Congress of Conservation Biology,12/06/2018,15/06/2018,,"Jyväskylä, Finland",Society for Conservation Biology,The theme of the Fifth European Congress of Conservation Biology (ECCB2018-5) is planetary wellbeing – a concept that captures the wellbeing of people as well as the integrity and sustainability of Earth's ecosystems. ,"ECCB2018-5 provides a forum to discuss and develop solutions for some of the key challenges faced by humanity by bringing together natural and social scientists, practitioners, industry members and government decision-makers.",http://conbio.org/mini-sites/eccb2018,,,Other relevance
CBD SBSTTA-22,02/07/2018,07/07/2018,,"Montreal, Canada",CBD Secretariat,"The Convention on Biological Diversity's (CBD) twenty-second meeting of the Subsidiary Body on Scientific, Technical and Technological Advice (SBSTTA-22) will focus on scientific and technical preparation for the CBD COP in November 2018. ",The meeting will include discussions regarding the follow up to the Strategic Plan for Biodiversity 2011-2020. Of particular relevance will be the ongoing review of progress towards the Strategic Plan for Biodiversity 2011-2020 and options for accelerating progress. ,https://www.cbd.int/meetings/SBSTTA-22,Intergovernmental processes,,Part of the formal process
4th Blue Planet Symposium,04/07/2018,06/08/2018,,"Toulouse, France",Group on Earth Observations,"The 4th Group on Earth Observations (GEO) Blue Planet Symposium will serve as a forum for discussion of ocean and coastal information needs for sustainable development, Blue Growth and societal awareness. The symposium will bring together producers of ocean and coastal information and current and potential users of ocean and coastal information.","This event aims to bridge the gap between data and services, to deliver usable information that supports informed decision-making and address policy mandates toward reaching sustainable development.",http://symposium.geoblueplanet.com/,Marine-focus,,Other relevance
CBD SBI-2,09/07/2018,13/07/2018,,"Montreal, Canada",CBD Secretariat,The Convention on Biological Diversity's (CBD) second meeting of the Subsidiary Body on Implementation (SBI-2) will focus on progress in the implementation preparation for the CBD COP in November 2018. ,The meeting will include discussions regarding the follow up to the Strategic Plan for Biodiversity 2011-2020. Of particular relevance will be the ongoing review of implementation of the Strategic Plan for Biodiversity 2011-2020 and synergies with other conventions. ,https://www.cbd.int/meetings/SBI-02,Intergovernmental processes,,Part of the formal process
Committee on Fisheries (COFI 33),09/07/2018,13/07/2018,,"Rome, Italy",FAO,"The Food and Agriculture Organisation (FAO) Committee on Fisheries (COFI) presently constitutes a global inter-governmental forum where major international fisheries and aquaculture problems and issues are examined and recommendations addressed to governments, regional fishery bodies, NGOs, fish workers, FAO and the international community, periodically on a world-wide basis. ","The provisional agenda covers biodiversity, including biodiversity mainstreaming in the work of FAO concerning fisheries and aquaculture.",http://www.fao.org/about/meetings/cofi/en/,Intergovernmental processes,,Other relevance
High-level Political Forum on Sustainable Development 2018,09/07/2018,18/07/2018,,"New York City, US",UN Economic and Social Council,"The theme of the High-level Political Forum on Sustainable Development (HLPF) 2018 will be: ""Transformation towards sustainable and resilient societies"". The sub-set of Sustainable Development Goals (SDGs) to be reviewed in depth will be: SDG 6, 7, 11, 12, 15 and 17.  In addition, 48 countries are expected to present their Voluntary National Reviews (VNRs).",The HLPF has a central role in the follow-up and review of the 2030 SDGs at the global level. The forum provides an opportunity to demonstrate how biodiversity underpins all of the 17 SDGs. ,https://sustainabledevelopment.un.org/hlpf/2018,Intergovernmental processes,,Other relevance
Committee on Forests (COFO 24),16/07/2018,20/07/2018,,"Rome, Italy",FAO,"The Food and Agriculture Organisation (FAO) Committee on Forestry (COFO) brings together heads of forest services and other senior government officials to identify emerging policy and technical issues, to seek solutions and to advise FAO and others on appropriate action.",This Committee provides the opportunity to discuss linkages between biodiversity and forestry-related issues,http://www.fao.org/about/meetings/cofo/en/,Intergovernmental processes,,Other relevance
UNGA 73,18/09/2018,30/09/2018,,"New York City, US",United Nations,"73rd Session of the UN General Assembly (UNGA 73) will bring together all 193 Member States of the UN to discuss and work together on a wide array of international issues covered by the UN Charter, such as development, peace and security, international law. ",Member states are likely to make commitments on biodiversity that may be relevant to the development of the post-2020 biodiversity process.,http://www.un.org/en/ga/,Intergovernmental processes,,Other relevance
2018 G20 – Buenos Aires summit,30/11/2018,01/12/2018,,"Buenos Aires, Argentina",Argentina,The Group of Twenty (G20) is a forum for international cooperation on financial and economic issues. ,Decisions taken by the G20 aim to bring about reform at both the national and international level. This summit also provides the opportunity to discuss linkages between biodiversity and economic and financial issues.,https://www.g20.org/en,Intergovernmental processes,,Other relevance
Committee on Agriculture (COAG-26),01/10/2018,05/10/2018,,"Rome, Italy",FAO,"The Committee on Agriculture (COAG) is one of the Food and Agriculture Organisation (FAO)’s Governing Bodies which aims to provide policy and regulatory guidance on issues relating to agriculture, livestock, food safety, nutrition, rural development and natural resource management.",This meeting could provide an opportunity to consider pathways to sustainable food and agriculture that do not compromise biodiversity.,http://www.fao.org/coag/about-coag/en/,Intergovernmental processes,,Other relevance
Committee on World Food Security (CFS-46),14/10/2018,18/10/2018,,"Rome, Italy",FAO,The Food and Agriculture Organisation (FAO) Committee on World Food Security (CFS) is an international and intergovernmental platform for stakeholders to work together to address food security and nutrition-related issues. ,This meeting could provide an opportunity to enhance coordination among different sectors and establish linkages between biodiversity and food security.,http://www.fao.org/cfs/en/,Intergovernmental processes,,Other relevance
Ramsar COP13,21/10/2018,29/10/2018,,"Dubai, UAE",Ramsar Convention Secretariat,"At the 13th meeting of the Conference of the Parties to the Ramsar Convention on Wetlands (Ramsar COP13), representatives of the governments of each of the Contracting Parties will meet to discuss, among other things the conservation and wise use of wetlands.",This meetings could provide the opportunity to enhance synergies between the Ramsar Convention on Wetlands and the CBD.,https://www.ramsar.org/event/13th-meeting-of-the-conference-of-the-parties,Intergovernmental processes,,Other relevance
GEO-XV Plenary,31/10/2018,01/11/2018,,"Kyoto, Japan",Group on Earth Observations, The Group on Earth Observations (GEO) Plenary is the highest decision-making body of GEO.,"The GEO Plenary provided an opportunity to exchange knowledge, identify gaps and reduce duplication in the areas of sustainable development and environmental management.",http://www.earthobservations.org/,,,Other relevance
CBD COP14,10/11/2018,22/11/2018,,"Sharm El-Sheikh, Egypt",CBD Secretariat,"The 14th meeting of the Conference of the Parties to the Convention on Biological Diversity (CBD COP14) will address a broad range of issues related to the objectives of the convention. This will include a review of the Convention's progress and implementation, the mainstreaming of biodiversity into key sectors and progress towards developing a post-2020 global biodiversity framework. ",It is expected that Parties will agree on a process for developing the post-2020 global biodiversity framework. The agenda will also include an assessment of the Convention's implementation of the Strategic Plan for Biodiversity 2011-2020 and progress towards achieving the Aichi Biodiversity targets. ,https://www.cbd.int/cop/,Intergovernmental processes,,Part of the formal process
Cartagena Protocol on Biosafety COPMOP9,10/11/2018,22/11/2018,,"Sharm El-Sheikh, Egypt",CBD Secretariat,The 9th Meeting of the Conference of the Parties serving as the Meeting of the Parties to the Cartagena Protocol on Biosafety (COPMOP9) is to review the implementation of the Cartagena Protocol on Biosafety and will contribute to decisions to promote its effective operation. ,It is anticipated that the post-2020 global biodiversity framework will cover the convention and its protocols.,http://bch.cbd.int/protocol/cpb_mopmeetings.shtml,Intergovernmental processes,,Part of the formal process
Nagoya Protocol on Access and Benefit-sharing COPMOP3,10/11/2018,22/11/2018,,"Sharm El-Sheikh, Egypt",CBD Secretariat,The 3rd Meeting of the Conference of the Parties serving as the meeting of the Parties to the Nagoya Protocol on Access and Benefit-sharing (COPMOP3) is to review the implementation of the Nagoya Protocol and make decisions to promote its effective operation.,It is anticipated that the post-2020 global biodiversity framework will cover the convention and its protocols.,https://www.cbd.int/abs/about/default.shtml,Intergovernmental processes,,Part of the formal process
